{
  "protocol": "layrs.sync.v3",
  "type": "syncTransactionReceipt",
  "principalId": "principal:alexa",
  "authorizationEpoch": 1,
  "resultingAuthorizationEpoch": 1,
  "authorizationSnapshotId": "blake3:3333333333333333333333333333333333333333333333333333333333333333",
  "currentPolicySetId": "blake3:4444444444444444444444444444444444444444444444444444444444444444",
  "spaceId": "space:demo",
  "clientId": "client:desktop-a",
  "idempotencyKey": "example-key-0001",
  "requestDigest": "blake3:0000000000000000000000000000000000000000000000000000000000000000",
  "transactionId": "transaction:demo-1",
  "status": "applied",
  "acceptedStepIds": [],
  "acceptedObservationIds": [],
  "acceptedRepositoryViewIds": ["blake3:2222222222222222222222222222222222222222222222222222222222222222"],
  "acceptedPolicySetIds": [],
  "acceptedProducts": [],
  "viewResult": {
    "mutationId": "mutation:view-1",
    "outcome": "no_op",
    "oldRepositoryViewId": "blake3:1111111111111111111111111111111111111111111111111111111111111111",
    "proposedRepositoryViewId": "blake3:2222222222222222222222222222222222222222222222222222222222222222",
    "newRepositoryViewId": "blake3:1111111111111111111111111111111111111111111111111111111111111111",
    "oldGeneration": 0,
    "newGeneration": 0,
    "layerResults": [{
      "layerId": "layer:main",
      "mode": "integrate",
      "previousHeads": [],
      "proposedHeads": [],
      "resultingHeads": [],
      "divergenceCreated": false,
      "decisionProductObjectId": null
    }],
    "eventId": null
  },
  "policyRootResult": null,
  "policyDecisions": [],
  "rejections": [],
  "eventIds": [],
  "firstEventSequence": null,
  "lastEventSequence": null,
  "eventCursor": "cursor-demo-0",
  "storedAt": "2026-07-19T12:00:00Z"
}
